Link,Movie_Name,Ratings,Movie_category,Film_Actor,Release_Date,Duration,Original_Language,Companies,Description,Box Office,Certificate (MPAA),Directors,Writing_Credits
https://www.rottentomatoes.com/m/hereditary,Hereditary,90%,"Horror, Mystery & Thriller","Ari Aster, Toni Collette, Gabriel Byrne, Alex Wolff, Ann Dowd, Milly Shapiro","Aug 21, 2018",2h 7m,English,"PalmStar Media,Windy Hill Pictures","When the matriarch of the Graham family passes away, her daughter and grandchildren begin to unravel cryptic and increasingly terrifying secrets about their ancestry, trying to outrun the sinister fate they have inherited.",$44.1M,R (Disturbing Images|Brief Graphic Nudity|Drug Use|Horror Violence|Language),Ari Aster,Ari Aster
https://www.rottentomatoes.com/m/better_watch_out,Better Watch Out,89%,"Horror, Holiday, Comedy, Mystery & Thriller","Chris Peckover, Levi Miller, Olivia DeJonge, Ed Oxenbould, Dacre Montgomery, Aleks Mikic","Oct 6, 2017",1h 29m,English,"Storm Vision Entertainment,Eclectik Vision,Best Medicine Productions",Ashley travels to the suburban home of the Lerners to baby-sit their 12-year-old son Luke at Christmastime. She must soon defend herself and the young boy when unwelcome intruders announce their arrival.,$20.3K,R (Crude Sexual References|All Involving Teens|Disturbing Violent Content|Drug and Alcohol Use|Language Throughout),Chris Peckover,"Zack Kahn, Chris Peckover"
https://www.rottentomatoes.com/m/notebook,The Notebook,54%,"Drama, Romance","Nick Cassavetes, Ryan Gosling, Rachel McAdams, James Garner, Gena Rowlands, James Marsden","Mar 18, 2013",2h 4m,English,"New Line Cinema,Avery Pix","In 1940s South Carolina, mill worker Noah Calhoun (Ryan Gosling) and rich girl Allie (Rachel McAdams) are desperately in love. But her parents don't approve. When Noah goes off to serve in World War II, it seems to mark the end of their love affair. In the interim, Allie becomes involved with another man (James Marsden). But when Noah returns to their small town years later, on the cusp of Allie's marriage, it soon becomes clear that their romance is anything but over.",$81.0M,PG-13 (Some Sexuality),Nick Cassavetes,"Nick Cassavetes, Jeremy Leven, Nicholas Sparks, Jan Sardi"
https://www.rottentomatoes.com/m/black_adam,Black Adam,39%,"Adventure, Action, Fantasy","Jaume Collet-Serra, Dwayne Johnson, Aldis Hodge, Noah Centineo, Sarah Shahi, Marwan Kenzari","Nov 22, 2022",2h 5m,English,"New Line Cinema,Flynn Picture Company,Seven Bucks Productions","Nearly 5,000 years after he was bestowed with the almighty powers of the ancient gods--and imprisoned just as quickly--Black Adam (Dwayne Johnson) is freed from his earthly tomb, ready to unleash his unique form of justice on the modern world.",$168.1M,PG-13 (Sequences of Strong Violence|Intense Action|Some Language),Jaume Collet-Serra,"Adam Sztykiel, Rory Haines, Sohrab Noshirvani"
https://www.rottentomatoes.com/m/street_trash_2024,Street Trash,,Horror,"Ryan Kruger, Sean Cameron Michael, Donna Cormack-Thomson, Joe Vaz, Lloyd Martinez Newkirk, Shuraigh Meyer","Nov 19, 2024",1h 25m,English,"Not the Funeral Home,Stage 5 Films,Protagonist","In the year 2050, global economic turmoil has destroyed the middle class in Cape Town, South Africa, which is now divided between the ultra-rich and the displaced. Ronald and a group of fellow houseless friends uncover a plot by the local government to 'wash away' the houseless population with a sinister chemical agent called 'V.' Now, they must risk everything to expose the truth and resist a society that's determined to erase them.",,,Ryan Kruger,"Ryan Kruger, James C. Williamson"
https://www.rottentomatoes.com/m/zootopia,Zootopia,98%,"Adventure, Kids & Family, Comedy, Animation","Byron Howard, Rich Moore, Ginnifer Goodwin, Jason Bateman, Shakira, Idris Elba","Jun 7, 2016",1h 48m,English,Walt Disney Animation Studios,"From the largest elephant to the smallest shrew, the city of Zootopia is a mammal metropolis where various animals live and thrive. When Judy Hopps (Ginnifer Goodwin) becomes the first rabbit to join the police force, she quickly learns how tough it is to enforce the law. Determined to prove herself, Judy jumps at the opportunity to solve a mysterious case. Unfortunately, that means working with Nick Wilde (Jason Bateman), a wily fox who makes her job even harder.",,PG (Rude Humor|Action|Some Thematic Elements),"Byron Howard, Rich Moore","Jared Bush, Phil Johnston"
https://www.rottentomatoes.com/m/the_bad_guys_2022,The Bad Guys,88%,"Adventure, Kids & Family, Comedy, Animation","Pierre Perifel, Sam Rockwell, Zazie Beetz, Marc Maron, Awkwafina, Craig Robinson","Jul 1, 2022",1h 39m,English,"Dentsu,Universal Pictures,Scholastic Entertainment Inc.,DreamWorks Animation","In the new action comedy from DreamWorks Animation, based on the New York Times best-selling book series, a crackerjack criminal crew of animal outlaws are about to attempt their most challenging con yet--becoming model citizens. Never have there been five friends as infamous as The Bad Guys--dashing pickpocket Mr. Wolf (Academy Award® winner Sam Rockwell, Three Billboards Outside Ebbing, Missouri), seen-it-all safecracker Mr. Snake (Marc Maron, GLOW), chill master-of-disguise Mr. Shark (Craig Robinson, Hot Tub Time Machine franchise), short-fused ""muscle"" Mr. Piranha (Anthony Ramos, In the Heights) and sharp-tongued expert hacker Ms. Tarantula (Awkwafina, Crazy Rich Asians), aka ""Webs."" But when, after years of countless heists and being the world's most-wanted villains, the gang is finally caught, Mr. Wolf brokers a deal (that he has no intention of keeping) to save them all from prison: The Bad Guys will go good. Under the tutelage of their mentor Professor Marmalade (Richard Ayoade, Paddington 2), an arrogant (but adorable!) guinea pig, The Bad Guys set out to fool the world that they've been transformed. Along the way, though, Mr. Wolf begins to suspect that doing good for real may give him what he’s always secretly longed for: acceptance. So when a new villain threatens the city, can Mr. Wolf persuade the rest of the gang to become... The Good Guys?",$97.2M,PG (Action and Rude Humor),Pierre Perifel,"Etan Cohen, Hilary Winston"
https://www.rottentomatoes.com/m/back_to_black,Back to Black,35%,"Drama, Music, Biography","Sam Taylor-Johnson, Marisa Abela, Jack O'Connell, Eddie Marsan, Juliet Cowan, Sam Buchanan","Jun 4, 2024",2h 2m,English,"StudioCanal,Monumental Pictures","The extraordinary story of Amy Winehouse's early rise to fame and the making of her groundbreaking album, Back to Black. Told from Amy's perspective and inspired by her deeply personal lyrics, the film follows the remarkable woman behind the phenomenon and the tumultuous relationship at the center of one of the most legendary albums of all time.",$6.0M,R (Language Throughout|Drug Use|Nudity|Sexual Content),Sam Taylor-Johnson,Matt Greenhalgh
https://www.rottentomatoes.com/m/things_will_be_different,Things Will Be Different,81%,"Sci-Fi, Horror, Mystery & Thriller","Michael Felker, Adam David Thompson, Riley Dandy, Chloe Skoczen, Justin Benson, Sarah Bolger","Oct 4, 2024",1h 42m,English,"Rustic Films,Last Life","When estranged siblings Joseph (Adam David Thompson) and Sidney (Riley Dandy) rendezvous at a local diner after a close-call robbery, they hightail it to an abandoned farmhouse that transports them to a different time in order to escape the law. Their getaway is derailed when an unknown and cryptic metaphysical force emerges and blocks them from returning home. Trapped on the puzzling plot of land, their captor makes it clear that no one can leave until their deadly demands are met. What results from their entrapment not only bends the forces of spacetime--forcing the two to question everything they know about their own reality--but pushes their familial bonds to the breaking point.",$4.0K,,Michael Felker,Michael Felker
https://www.rottentomatoes.com/m/bone_tomahawk,Bone Tomahawk,91%,"Western, Comedy, Action, Horror","S. Craig Zahler, Kurt Russell, Patrick Wilson, Richard Jenkins, Matthew Fox, Lili Simmons","Mar 11, 2017",2h 12m,English,Caliber Media Company,"In the Old West, a sheriff (Kurt Russell), his deputy (Richard Jenkins), a gunslinger (Matthew Fox),and a cowboy (Patrick Wilson) embark on a mission to rescue three people from a savage group of cave dwellers.",,,S. Craig Zahler,S. Craig Zahler
https://www.rottentomatoes.com/m/transformers_rise_of_the_beasts,Transformers: Rise of the Beasts,51%,"Adventure, Sci-Fi, Action, Fantasy","Steven Caple Jr., Anthony Ramos, Dominique Fishback, Ron Perlman, Michelle Yeoh, Pete Davidson","Jul 11, 2023",2h 7m,English,"Di Bonaventura Pictures,Skydance Media,New Republic Pictures,Hasbro,Bay Films","Returning to the action and spectacle that have captured moviegoers around the world, Transformers: Rise of the Beasts will take audiences on a '90s globetrotting adventure with the Autobots and introduce a whole new faction of Transformer -- the Maximals -- to the existing battle on earth between Autobots and Decepticons.",$156.7M,PG-13 (Language|Intense Sci-Fi Action|Violence),Steven Caple Jr.,"Joby Harold, Darnell Metayer, Josh Peters, Erich Hoeber, Jon Hoeber"
https://www.rottentomatoes.com/m/last_christmas_2019,Last Christmas,46%,"Comedy, Holiday, Romance","Paul Feig, Emilia Clarke, Henry Golding, Michelle Yeoh, Emma Thompson, Rebecca Root","Nov 8, 2019",1h 42m,English,"Universal Pictures,Feigco Entertainment","Nothing seems to go right for young Kate, a frustrated Londoner who works as an elf in a year-round Christmas shop. But things soon take a turn for the better when she meets Tom -- a handsome charmer who seems too good to be true. As the city transforms into the most wonderful time of the year, Tom and Kate's growing attraction turns into the best gift of all -- a Yuletide romance.",$35.1M,PG-13 (Language and Sexual Content),Paul Feig,"Emma Thompson, Bryony Kimmings"
https://www.rottentomatoes.com/m/krampus,Krampus,66%,"Horror, Holiday, Comedy, Fantasy","Michael Dougherty, Emjay Anthony, Adam Scott, Toni Collette, Stefania Owen, Krista Stadler","Sep 6, 2016",1h 38m,English,"Legendary Pictures,Zam Pictures","While the holiday season represents the most magical time of year, ancient European folklore warns of Krampus, a horned beast who punishes naughty children at Christmastime. When dysfunctional family squabbling causes young Max (Emjay Anthony) to lose his festive spirit, it unleashes the wrath of the fearsome demon. As Krampus lays siege to the Engel home, mom (Toni Collette), pop (Adam Scott), sister (Stefania LaVie Owen) and brother must band together to save one another from a monstrous fate.",$42.7M,PG-13 (Sequences of Horror Violence|Language|Some Drug Material|Terror),Michael Dougherty,"Todd Casey, Michael Dougherty, Zach Shields"
https://www.rottentomatoes.com/m/once_upon_a_time_in_hollywood,Once Upon a Time... In Hollywood,86%,"Drama, Comedy","Quentin Tarantino, Leonardo DiCaprio, Brad Pitt, Margot Robbie, Kurt Russell, Dakota Fanning","Aug 27, 2019",2h 39m,English,"Columbia Pictures,Bona Film Group,Heyday Films","Actor Rick Dalton gained fame and fortune by starring in a 1950s television Western, but is now struggling to find meaningful work in a Hollywood that he doesn't recognize anymore. He spends most of his time drinking and palling around with Cliff Booth, his easygoing best friend and longtime stunt double. Rick also happens to live next door to Roman Polanski and Sharon Tate -- the filmmaker and budding actress whose futures will forever be altered by members of the Manson Family.",$142.4M,R (Language Throughout|Drug Use|Sexual References|Some Strong Graphic Violence),Quentin Tarantino,Quentin Tarantino
https://www.rottentomatoes.com/m/blue_beetle,Blue Beetle,77%,"Adventure, Action","Angel Manuel Soto, Xolo Maridueña, Adriana Barraza, Damián Alcázar, Elpidia Carrillo, Becky G","Sep 26, 2023",2h 7m,English,"Warner Bros.,DC Entertainment,Safran Company","Recent college grad Jaime Reyes returns home full of aspirations for his future, only to find that home is not quite as he left it. As he searches to find his purpose in the world, fate intervenes when Jaime unexpectedly finds himself in possession of an ancient relic of alien biotechnology: the Scarab. When the Scarab suddenly chooses Jaime to be its symbiotic host, he is bestowed with an incredible suit of armor capable of extraordinary and unpredictable powers, forever changing his destiny as he becomes the Super Hero BLUE BEETLE.",$72.5M,PG-13 (Sequences of Action|Language|Some Suggestive References|Violence),Angel Manuel Soto,Gareth Dunnet-Alcocer
https://www.rottentomatoes.com/m/titanic,Titanic,88%,"History, Drama, Romance","James Cameron, Leonardo DiCaprio, Kate Winslet, Billy Zane, Kathy Bates, Frances Fisher","Jun 1, 2014",3h 15m,English,"20th Century Fox,Lightstorm Entertainment,Paramount Pictures",A society girl abandons her haughty fiance for a penniless artist on the ill-fated ship's maiden voyage.,$658.8M,PG-13 (Disaster Related Peril|Brief Language|Nudity|Sensuality|Violence),James Cameron,James Cameron
https://www.rottentomatoes.com/m/spider_man_into_the_spider_verse,Spider-Man: Into the Spider-Verse,97%,"Adventure, Fantasy, Animation, Action, Comedy, Kids & Family","Bob Persichetti, Peter Ramsey, Rodney Rothman, Shameik Moore, Jake Johnson, Hailee Steinfeld","Mar 7, 2019",1h 57m,English,"Lord Miller,Sony Pictures Animation,Pascal Pictures,Avi Arad","Bitten by a radioactive spider in the subway, Brooklyn teenager Miles Morales suddenly develops mysterious powers that transform him into the one and only Spider-Man. When he meets Peter Parker, he soon realizes that there are many others who share his special, high-flying talents. Miles must now use his newfound skills to battle the evil Kingpin, a hulking madman who can open portals to other universes and pull different versions of Spider-Man into our world.",$190.2M,PG (Mild Language|Frenetic Action Violence|Thematic Elements),"Bob Persichetti, Peter Ramsey, Rodney Rothman","Phil Lord, Rodney Rothman"
https://www.rottentomatoes.com/m/the_northman,The Northman,90%,"Adventure, Action, Mystery & Thriller","Robert Eggers, Alexander Skarsgård, Nicole Kidman, Claes Bang, Ethan Hawke, Anya Taylor-Joy","May 13, 2022",2h 17m,English,"Square Peg,New Regency,Perfect World Pictures,Focus Features,Universal Pictures","The Northman is an epic revenge thriller, that explores how far a Viking prince will go to seek justice for his murdered father.",$34.2M,R (Some Sexual Content|Nudity|Strong Bloody Violence),Robert Eggers,"Sjón, Robert Eggers"
https://www.rottentomatoes.com/m/aladdin,Aladdin,57%,"Adventure, Fantasy, Comedy, Romance, Kids & Family, Musical","Guy Ritchie, Will Smith, Mena Massoud, Naomi Scott, Marwan Kenzari, Navid Negahban","Aug 27, 2019",2h 8m,English,Rideback,"Aladdin is a lovable street urchin who meets Princess Jasmine, the beautiful daughter of the sultan of Agrabah. While visiting her exotic palace, Aladdin stumbles upon a magic oil lamp that unleashes a powerful, wisecracking, larger-than-life genie. As Aladdin and the genie start to become friends, they must soon embark on a dangerous mission to stop the evil sorcerer Jafar from overthrowing young Jasmine's kingdom.",$355.6M,PG (Some Action/Peril),Guy Ritchie,"John August, Guy Ritchie"
https://www.rottentomatoes.com/m/glass_onion_a_knives_out_mystery,Glass Onion: A Knives Out Mystery,91%,"Drama, Comedy, Mystery & Thriller","Rian Johnson, Daniel Craig, Edward Norton, Dave Bautista, Kate Hudson, Kathryn Hahn","Dec 23, 2022",2h 20m,English,"Lionsgate,Netflix,T-Street","Benoit Blanc returns to peel back the layers in a new Rian Johnson whodunit. This fresh adventure finds the intrepid detective at a lavish private estate on a Greek island, but how and why he comes to be there is only the first of many puzzles. Blanc soon meets a distinctly disparate group of friends gathering at the invitation of billionaire Miles Bron for their yearly reunion. Among those on the guest list are Miles' former business partner Andi Brand, current Connecticut governor Claire Debella, cutting-edge scientist Lionel Toussaint, fashion designer and former model Birdie Jay and her conscientious assistant Peg, and influencer Duke Cody and his sidekick girlfriend Whiskey. As in all the best murder mysteries, each character harbors their own secrets, lies and motivations. When someone turns up dead, everyone is a suspect.",,PG-13 (Sexual Material|Drug Content|Some Violence|Strong Language),Rian Johnson,Rian Johnson
https://www.rottentomatoes.com/m/the_irishman,The Irishman,95%,"Crime, Drama","Martin Scorsese, Robert De Niro, Al Pacino, Joe Pesci, Anna Paquin, Harvey Keitel","Nov 27, 2019",3h 29m,English,"Tribeca Productions,Winkler Films,Sikelia Productions","In the 1950s, truck driver Frank Sheeran gets involved with Russell Bufalino and his Pennsylvania crime family. As Sheeran climbs the ranks to become a top hit man, he also goes to work for Jimmy Hoffa -- a powerful Teamster tied to organized crime.",,R (Strong Violence|Pervasive Language),Martin Scorsese,Steven Zaillian
https://www.rottentomatoes.com/m/red_rooms,Red Rooms,96%,"Crime, Drama, Mystery & Thriller","Pascal Plante, Juliette Gariépy, Laurie Babin, Elisabeth Locas, Natalie Tannous, Pierre Chagnon","Oct 4, 2024",1h 58m,Canadian French,Nemesis Films Productions,"The high-profile case of serial killer Ludovic Chevalier has just gone to trial, and Kelly-Anne is obsessed. When reality blurs with her morbid fantasies, she goes down a dark path to seek the final piece of the puzzle: the missing video of a murdered 13-year-old girl, to whom Kelly-Anne bears a disturbing resemblance.",$83.1K,,Pascal Plante,Pascal Plante
https://www.rottentomatoes.com/m/home_alone_2_lost_in_new_york,Home Alone 2: Lost in New York,35%,"Kids & Family, Holiday, Comedy","Chris Columbus, Macaulay Culkin, Joe Pesci, Daniel Stern, Catherine O'Hara, John Heard","Mar 1, 2013",2h 0m,English,20th Century Fox,"After snarky youth Kevin McCallister (Macaulay Culkin) loses track of his father at the airport, he mistakenly gets on a plane headed for New York City -- while the rest of the McCallisters fly to Florida. Now alone in the Big Apple, Kevin cons his way into a room at the Plaza Hotel and begins his usual antics. But when Kevin discovers that the Sticky Bandits (Joe Pesci, Daniel Stern) are on the loose, he struggles to stop them from robbing an elderly man's toy store just before Christmas.",$172.7M,PG,Chris Columbus,John Hughes
https://www.rottentomatoes.com/m/heavier_trip,Heavier Trip,,Comedy,"Juuso Laatio, Jukka Vidgren, Johannes Holopainen, Max Ovaska, Chike Ohanwe, Samuli Jaskio","Nov 29, 2024",1h 36m,Finnish,Making Movies Oy,"The world’s most ferocious death metal band, Impaled Rektum, is back and ready to unleash hell! Shackled by fate and locked up in a Norwegian prison, the band discovers their lead guitarist’s family reindeer slaughterhouse faces a financial storm. Turo, Lotvonen, Xytrax and Oula hatch a daring escape plan to help. Desperate for the money, and the chance to perform at the ultimate battleground for metal warriors, Impaled Rektum takes a journey through northern Europe to the legendary Wacken music festival. But hot on their trail is a vengeful prison guard, thirsting for revenge, and a sketchy record label executive, weaving lies that could shatter their dreams and worse, compromise the integrity of the band. Amidst the chaos, the band must forge a bond stronger than the darkest riffs — forging alliances with the most unexpected compatriots, including an epic cameo from the Japanese Kawaii-metal band, Babymetal. Only the raw power of metal can determine their fate! Prepare for a relentless odyssey of sound, fury, and the unbreakable spirit of true heavy metal in this sequel to cult classic HEAVY TRIP.",,,"Juuso Laatio, Jukka Vidgren","Juuso Laatio, Jukka Vidgren"
https://www.rottentomatoes.com/m/eternals,Eternals,47%,"Adventure, Action, Fantasy","Chloé Zhao, Angelina Jolie, Salma Hayek, Kit Harington, Gemma Chan, Richard Madden","Jan 12, 2022",2h 37m,English,Marvel Studios,"Marvel Studios' Eternals features an exciting new team of Super Heroes in the Marvel Cinematic Universe, ancient aliens who have been living on Earth in secret for thousands of years. Following the events of Avengers: Endgame, an unexpected tragedy forces them out of the shadows to reunite against mankind's most ancient enemy, the Deviants.",$164.9M,PG-13 (Fantasy Violence and Action|Brief Sexuality|Some Language),Chloé Zhao,"Chloé Zhao, Ryan Firpo, Kaz Firpo"
https://www.rottentomatoes.com/m/all_quiet_on_the_western_front_2022,All Quiet on the Western Front,90%,"History, Drama, War, Action","Edward Berger, Felix Kammerer, Albrecht Schuch, Aaron Hilmer, Moritz Klaus, Edin Hasanovic","Oct 28, 2022",2h 28m,German,"Amusement Park Films,Sliding Down Rainbows Entertainment,Rocket Science","All Quiet on the Western Front tells the gripping story of a young German soldier on the Western Front of World War I. Paul and his comrades experience first-hand how the initial euphoria of war turns into desperation and fear as they fight for their lives, and each other, in the trenches. The film from director Edward Berger is based on the world renowned bestseller of the same name by Erich Maria Remarque.",,R (Strong Bloody War Violence|Grisly Images),Edward Berger,"Lesley Paterson, Ian Stokell"
https://www.rottentomatoes.com/m/kill_2023_2,Kill,89%,"Action, Mystery & Thriller","Nikhil Nagesh Bhat, Laksh Lalwani, Tanya Maniktala, Raghav Juyal, Abhishek Chauhan, Rupesh Kumar Charanpahari","Jul 23, 2024",1h 46m,Hindi,Sikhya Entertainment,"When army commando Amrit (Lakshya) finds out his true love Tulika (Tanya Maniktala) is engaged against her will, he boards a New Delhi-bound train in a daring quest to derail the arranged marriage. But when a gang of knife-wielding thieves led by the ruthless Fani (Raghav Juyal) begin to terrorize innocent passengers on his train, Amrit takes them on himself in a death-defying kill-spree to save those around him -- turning what should have been a typical commute into an adrenaline-fueled thrill ride.",$1.2M,R,Nikhil Nagesh Bhat,Nikhil Nagesh Bhat
https://www.rottentomatoes.com/m/butterfly_effect,The Butterfly Effect,34%,Mystery & Thriller,"Eric Bress, J. Mackye Gruber, Ashton Kutcher, Amy Smart, Eric Stoltz, William Lee Scott","Jul 1, 2008",1h 53m,English,"Katalyst Films,Blackout Entertainment,Benderspink,Film Engine","College student Evan Treborn (Ashton Kutcher) is afflicted with headaches so painful that he frequently blacks out. While unconscious, Evan is able to travel back in time to difficult moments in his childhood. He can also alter the past for friends, like Kayleigh (Amy Smart), who was molested by her father (Eric Stoltz). But changing the past can drastically alter the present, and Evan finds himself in nightmarish alternate realities, including one where he's locked away in prison.",$57.7M,R (Language|Brief Drug Use|Sexual Content|Violence),"Eric Bress, J. Mackye Gruber","Eric Bress, J. Mackye Gruber"
https://www.rottentomatoes.com/m/avatar_the_way_of_water,Avatar: The Way of Water,76%,"Adventure, Sci-Fi, Action, Fantasy","James Cameron, Sam Worthington, Zoe Saldana, Sigourney Weaver, Stephen Lang, Cliff Curtis","Mar 28, 2023",3h 12m,English,"20th Century Studios,Lightstorm Entertainment","Set more than a decade after the events of the first film, ""Avatar: The Way of Water"" begins to tell the story of the Sully family (Jake, Neytiri, and their kids), the trouble that follows them, the lengths they go to keep each other safe, the battles they fight to stay alive, and the tragedies they endure.",$684.1M,PG-13 (Partial Nudity|Intense Action|Sequences of Strong Violence|Some Strong Language),James Cameron,"James Cameron, Rick Jaffa, Amanda Silver"
https://www.rottentomatoes.com/m/law_abiding_citizen,Law Abiding Citizen,26%,"Crime, Drama, Mystery & Thriller","F. Gary Gray, Jamie Foxx, Gerard Butler, Colm Meaney, Bruce McGill, Leslie Bibb","Feb 5, 2016",1h 48m,English,Warp Films,"Clyde Shelton (Gerard Butler) is an honorable family man, until the day his wife and daughter are murdered in a home invasion. He hopes for justice, but a rising prosecutor named Nick Rice (Jamie Foxx) cuts a deal with one of the killers in exchange for testimony. Ten years later, that man is found dead and Shelton coolly admits his guilt. Then he hands Rice an ultimatum: Fix the broken legal system or suffer the consequences.",$73.3M,R (Rape|Pervasive Language|Strong Bloody Brutal Violence|Torture),F. Gary Gray,Kurt Wimmer
https://www.rottentomatoes.com/m/nope,Nope,83%,"Sci-Fi, Horror, Mystery & Thriller","Jordan Peele, Daniel Kaluuya, Keke Palmer, Steven Yeun, Michael Wincott, Brandon Perea","Nov 18, 2022",2h 15m,English,"Monkeypaw Productions,Universal Pictures Benelux,Universal Pictures","A man and his sister discover something sinister in the skies above their California horse ranch, while the owner of a nearby theme park tries to profit from the mysterious, otherworldly phenomenon.",$123.2M,R (Some Violence/Bloody Images|Language Throughout),Jordan Peele,Jordan Peele
https://www.rottentomatoes.com/m/the_kings_man,The King's Man,42%,"Adventure, Action","Matthew Vaughn, Ralph Fiennes, Harris Dickinson, Rhys Ifans, Djimon Hounsou, Gemma Arterton","Feb 18, 2022",2h 11m,English,"Marv Studios,Cloudy Productions,20th Century Studios","As a collection of history's worst tyrants and criminal masterminds gather to plot a war to wipe out millions, one man must race against time to stop them. Discover the origins of the very first independent intelligence agency in ""The King's Man.""",$37.2M,R (Some Sexual Material|Language|Strong/Bloody Violence),Matthew Vaughn,"Matthew Vaughn, Karl Gajdusek"
