Link,Movie_Name,Ratings,Movie_category,Film_Actor,Release_Date,Duration,Original_Language,Companies,Description,Box Office,Certificate (MPAA),Directors,Writing_Credits
https://www.rottentomatoes.com/m/gladiator,Gladiator,80%,"History, Adventure, Drama, Action","Ridley Scott, Russell Crowe, Joaquin Phoenix, Connie Nielsen, Oliver Reed, Derek Jacobi","Jun 15, 2011",2h 34m,English,"Universal Pictures,Scott Free Productions,DreamWorks Pictures","Commodus (Joaquin Phoenix) takes power and strips rank from Maximus (Russell Crowe), one of the favored generals of his predecessor and father, Emperor Marcus Aurelius, the great stoical philosopher. Maximus is then relegated to fighting to the death in the gladiator arenas.",$187.7M,R (Intense Graphic Combat),Ridley Scott,"David Franzoni, John Logan, William Nicholson, David Franzoni"
https://www.rottentomatoes.com/m/the_substance,The Substance,90%,"Horror, Drama","Coralie Fargeat, Demi Moore, Margaret Qualley, Dennis Quaid, Hugo Diego Garcia, Gore Abrams","Oct 31, 2024",2h 21m,English,Working Title Films,"Have you ever dreamt of a better version of yourself? You, only better in every way. You should try this new product, it's called The Substance. IT CHANGED MY LIFE. With The Substance, you can generate another you: younger, more beautiful, more perfect. You just have to share time -- one week for one, one week for the other. A perfect balance of seven days each... Easy right? If you respect the balance... What could possibly go wrong?",$15.5M,R (Graphic Nudity|Gore|Language|Strong Violent Content),Coralie Fargeat,Coralie Fargeat
https://www.rottentomatoes.com/m/hot_frosty,Hot Frosty,85%,"Comedy, Romance, Fantasy, Holiday","Jerry Ciccoritti, Lacey Chabert, Dustin Milligan, Katy Mixon, Lauren Holly, Chrishell Stause","Nov 13, 2024",1h 32m,English,"Muse Entertainment Enterprises,Muse Entertainment LLC","Two years after losing her husband, Kathy magically brings a handsome snowman to life! Through his naïveté, the snowman helps Kathy to laugh, feel and love again, as the two fall for each other just in time for the holidays... and before he melts.",,,Jerry Ciccoritti,Russell Hainline
https://www.rottentomatoes.com/m/blitz,Blitz,81%,"History, Drama, War","Steve McQueen, Saoirse Ronan, Elliott Heffernan, Leigh Gill, Harris Dickinson, Erin Kellyman","Nov 22, 2024",2h 0m,British English,"New Regency Productions,Working Title Films,Lammas Park,Apple Studios","Sir Steve McQueen's ""Blitz"" follows the epic journey of George (Elliott Heffernan), a 9-year-old boy in World War II London whose mother Rita (Saoirse Ronan) sends him to safety in the English countryside. George, defiant and determined to return home to his mom and his grandfather Gerald (Paul Weller) in East London, embarks on an adventure, only to find himself in immense peril, while a distraught Rita searches for her missing son.",,PG-13,Steve McQueen,Steve McQueen
https://www.rottentomatoes.com/m/conclave,Conclave,92%,"Drama, Mystery & Thriller","Edward Berger, Ralph Fiennes, Stanley Tucci, John Lithgow, Lucian Msamati, Brian F. O'Byrne","Nov 26, 2024",2h 0m,English,"FilmNation Entertainment,House Productions","CONCLAVE follows one of the world’s most secretive and ancient events -- selecting the new Pope. Cardinal Lawrence (Ralph Fiennes) is tasked with running this covert process after the unexpected death of the beloved Pope. Once the Catholic Church’s most powerful leaders have gathered from around the world and are locked together in the Vatican halls, Lawrence uncovers a trail of deep secrets left in the dead Pope’s wake, secrets which could shake the foundations of the Church.",$15.0M,PG (Thematic Material and Smoking),Edward Berger,Peter Straughan
https://www.rottentomatoes.com/m/the_piano_lesson,The Piano Lesson,90%,"Drama, Music","Malcolm Washington, Samuel L. Jackson, John David Washington, Danielle Deadwyler, Ray Fisher, Corey Hawkins","Nov 22, 2024",2h 5m,English,"Lord Miller,Netflix Studios","Set in 1936 Pittsburgh during the aftermath of the Great Depression, The Piano Lesson follows the lives of the Charles family in the Doaker Charles household and an heirloom, the family piano, which documents the family history through carvings made by their enslaved ancestor.",,PG-13,Malcolm Washington,"Malcolm Washington, Virgil Williams"
https://www.rottentomatoes.com/m/the_wild_robot,The Wild Robot,97%,"Adventure, Kids & Family, Animation","Christopher Sanders, Lupita Nyong'O, Pedro Pascal, Catherine O'Hara, Bill Nighy, Kit Connor","Oct 15, 2024",1h 42m,English,DreamWorks Animation,"The epic adventure follows the journey of a robot--ROZZUM unit 7134, ""Roz"" for short -- that is shipwrecked on an uninhabited island and must learn to adapt to the harsh surroundings, gradually building relationships with the animals on the island and becoming the adoptive parent of an orphaned gosling.",,PG (Thematic Elements|Action/Peril),Christopher Sanders,Christopher Sanders
https://www.rottentomatoes.com/m/my_old_ass,My Old Ass,90%,"Drama, Comedy, Fantasy","Megan Park, Maisy Stella, Aubrey Plaza, Percy Hynes White, Maddie Ziegler, Kerrice Brooks","Nov 7, 2024",1h 29m,English,"Indian Paintbrush,LuckyChap Entertainment","In this fresh coming-of-age story, an 18th birthday mushroom trip brings free-spirited Elliott (Maisy Stella) face-to-face with her wisecracking 39-year-old self (Aubrey Plaza). But when Elliott's ""old ass"" starts handing out warnings about what her younger self should and shouldn't do, Elliott realizes she has to rethink everything about family, love, and what's becoming a transformative summer.",$5.2M,R (Sexual Material|Language Throughout|Drug Use),Megan Park,Megan Park
https://www.rottentomatoes.com/m/alien_romulus,Alien: Romulus,80%,"Sci-Fi, Horror","Fede Alvarez, Cailee Spaeny, David Jonsson, Archie Renaux, Isabela Merced, Spike Fearn","Oct 15, 2024",1h 59m,English,"Scott Free Productions,Brandywine Productions","While scavenging the deep ends of a derelict space station, a group of young space colonizers come face to face with the most terrifying life form in the universe.",$105.3M,R (Language|Bloody Violent Content),Fede Alvarez,"Fede Alvarez, Rodo Sayagues Mendez"
https://www.rottentomatoes.com/m/smile_2,Smile 2,86%,"Horror, Mystery & Thriller","Parker Finn, Naomi Scott, Rosemarie DeWitt, Kyle Gallner, Lukas Gage, Miles Gutierrez-Riley","Nov 19, 2024",2h 7m,English,"Paramount Players,Temple Hill Entertainment,Bad Feeling","About to embark on a new world tour, global pop sensation Skye Riley (Naomi Scott) begins experiencing increasingly terrifying and inexplicable events. Overwhelmed by the escalating horrors and the pressures of fame, Skye is forced to face her dark past to regain control of her life before it spirals out of control.",$52.6M,R (Grisly Images|Drug Use|Language Throughout|Strong Violent Content),Parker Finn,Parker Finn
https://www.rottentomatoes.com/m/spellbound_2024,Spellbound,44%,"Adventure, Animation, Fantasy, Comedy, Kids & Family","Vicky Jenson, Rachel Zegler, Miguel Bernardeau, Jenifer Lewis, Dee Bradley Baker, Nicole Kidman","Nov 22, 2024",1h 50m,English,Skydance Animation,"Spellbound follows the adventures of Ellian, the tenacious young daughter of the rulers of Lumbria who must go on a daring quest to save her family and kingdom after a mysterious spell transforms her parents into monsters.",,PG,Vicky Jenson,"Vicky Jenson, Lauren Hynek, Elizabeth Martin, Lauren Hynek, Elizabeth Martin, Julia Miranda"
https://www.rottentomatoes.com/m/dear_santa_2024,Dear Santa,,"Comedy, Holiday, Fantasy","Robert Farrelly, Jack Black, Keegan-Michael Key, Brianne Howey, Post Malone, Hayes MacArthur","Nov 25, 2024",1h 48m,English,Conundrum Entertainment,"When a young boy mails his Christmas wish list to Santa with one crucial spelling error, a devilish Jack Black arrives to wreak havoc on the holidays. From the hilarious minds behind DUMB & DUMBER, Christmas is about to go up in flames.",,PG-13 (Some Language|Suggestive Material),Robert Farrelly,"Ricky Blitt, Peter Farrelly"
https://www.rottentomatoes.com/m/we_live_in_time,We Live in Time,77%,"Drama, Romance","John Crowley, Andrew Garfield, Florence Pugh, Adam James, Aoife Hinds, Marama Corlett","Nov 22, 2024",1h 48m,English,"SunnyMarch,Shoebox Films","Almut (Florence Pugh) and Tobias (Andrew Garfield) are brought together in a surprise encounter that changes their lives. Through snapshots of their life together -- falling for each other, building a home, becoming a family -- a difficult truth is revealed that rocks its foundation. As they embark on a path challenged by the limits of time, they learn to cherish each moment of the unconventional route their love story has taken, in filmmaker John Crowley's decade-spanning, deeply moving romance.",,R,John Crowley,Nick Payne
https://www.rottentomatoes.com/m/joker_folie_a_deux,Joker: Folie à Deux,32%,"Crime, Drama, Musical","Todd Phillips, Joaquin Phoenix, Lady Gaga, Zazie Beetz, Brendan Gleeson, Catherine Keener","Oct 29, 2024",2h 18m,English,Joint Effort,"""Joker: Folie à Deux"" finds Arthur Fleck institutionalized at Arkham awaiting trial for his crimes as Joker. While struggling with his dual identity, Arthur not only stumbles upon true love, but also finds the music that's always been inside him.",$58.2M,R (Language Throughout|Brief Full Nudity|Some Sexuality|Some Strong Violence),Todd Phillips,"Scott Silver, Todd Phillips"
https://www.rottentomatoes.com/m/deadpool_and_wolverine,Deadpool & Wolverine,79%,"Adventure, Comedy, Action","Shawn Levy, Ryan Reynolds, Hugh Jackman, Emma Corrin, Morena Baccarin, Rob Delaney","Oct 1, 2024",2h 8m,English,"20th Century Studios,Marvel Studios,Maximum Effort,TSG Entertainment","Deadpool's peaceful existence comes crashing down when the Time Variance Authority recruits him to help safeguard the multiverse. He soon unites with his would-be pal, Wolverine, to complete the mission and save his world from an existential threat.",$636.7M,R (Language Throughout|Gore|Sexual References|Strong Bloody Violence),Shawn Levy,"Ryan Reynolds, Rhett Reese, Paul Wernick, Zeb Wells, Shawn Levy"
https://www.rottentomatoes.com/m/moana_2016,Moana,95%,"Adventure, Animation, Comedy, Kids & Family, Musical","John Musker, Ron Clements, Auli'I Cravalho, Dwayne Johnson, Rachel House, Temuera Morrison","Feb 21, 2017",1h 47m,English,Walt Disney Animation Studios,"An adventurous teenager sails out on a daring mission to save her people. During her journey, Moana meets the once-mighty demigod Maui, who guides her in her quest to become a master way-finder. Together they sail across the open ocean on an action-packed voyage, encountering enormous monsters and impossible odds. Along the way, Moana fulfills the ancient quest of her ancestors and discovers the one thing she always sought: her own identity.",$248.8M,PG (Peril|Brief Thematic Elements|Some Scary Images),"John Musker, Ron Clements",Jared Bush
https://www.rottentomatoes.com/m/emilia_perez,Emilia Pérez,78%,"Musical, Crime, Drama","Jacques Audiard, Zoe Saldana, Karla Sofía Gascón, Selena Gomez, Adriana Paz, Edgar Ramírez","Nov 13, 2024",2h 12m,English,"Pimienta Films,LPI Media,Why Not Productions,Page 114,Saint Laurent Productions,France 2 Cinéma,Pathé Films","From renegade auteur Jacques Audiard comes Emilia Pérez, an audacious fever dream that defies genres and expectations. Through liberating song and dance and bold visuals, this odyssey follows the journey of four remarkable women in Mexico, each pursuing their own happiness. The fearsome cartel leader Emilia (Karla Sofía Gascón) enlists Rita (Zoe Saldaña), an unappreciated lawyer stuck in a dead-end job, to help fake her death so that Emilia can finally live authentically as her true self.",,R (Some Violent Content|Sexual Material|Language),Jacques Audiard,"Jacques Audiard, Thomas Bidegain"
https://www.rottentomatoes.com/m/here_2024,Here,35%,Drama,"Robert Zemeckis, Tom Hanks, Robin Wright, Paul Bettany, Kelly Reilly, Michelle Dockery","Nov 26, 2024",1h 44m,English,"Miramax,ImageMovers","Reuniting the director, writer and stars of Forrest Gump, Here is an original film about multiple families and a special place they inhabit. The story travels through generations, capturing the most relatable of human experiences. Zemeckis (Forrest Gump, Castaway, Who Framed Roger Rabbit, Contact, Back to the Future) directs from a screenplay by Eric Roth (Forrest Gump, Killers of the Flower Moon, Dune, A Star is Born) and him. Told much in the style of the acclaimed graphic novel by Richard McGuire on which it is based, Tom Hanks and Robin Wright star in a tale of love, loss, laughter and life, all of which happen right Here.",$4.8M,PG-13,Robert Zemeckis,"Eric Roth, Robert Zemeckis"
https://www.rottentomatoes.com/m/saturday_night_2024,Saturday Night,78%,"Drama, Comedy","Jason Reitman, Gabriel LaBelle, Dylan O'Brien, Cory Michael Smith, Rachel Sennott, Lamorne Morris","Nov 12, 2024",1h 49m,English,Sony Pictures Releasing,"At 11:30pm on October 11, 1975, a ferocious troupe of young comedians and writers changed television -- and culture -- forever. Directed by Jason Reitman and written by Gil Kenan & Reitman, Saturday Night is based on the true story of what happened behind the scenes in the 90 minutes leading up to the first broadcast of Saturday Night Live. Full of humor, chaos, and the magic of a revolution that almost wasn't, we count down the minutes in real time until we hear those famous words....",$9.3M,R (Sexual References|Language Throughout|Brief Graphic Nudity|Some Drug Use),Jason Reitman,"Gil Kenan, Jason Reitman"
https://www.rottentomatoes.com/m/woman_of_the_hour,Woman of the Hour,91%,"Crime, Drama, Mystery & Thriller","Anna Kendrick, Anna Kendrick, Tony Hale, Kelley Jakle, Max Lloyd-Jones, Jedidiah Goodacre","Oct 18, 2024",1h 29m,English,"BoulderLight Pictures,AGC Studios","An aspiring actress crosses paths with a prolific serial killer in '70s LA when they're cast on an episode of ""The Dating Game."" Based on a true story.",,R (Language|A Sexual Reference|Some Drug Use|Violent Content),Anna Kendrick,Ian MacAllister McDonald
https://www.rottentomatoes.com/m/ready_or_not_2019,Ready or Not,89%,"Horror, Comedy, Mystery & Thriller","Matt Bettinelli-Olpin, Tyler Gillett, Samara Weaving, Adam Brody, Mark O'Brien, Henry Czerny","Aug 27, 2019",1h 35m,English,"Vinson Films,Mythology Entertainment","Grace couldn't be happier after she marries the man of her dreams at his family's luxurious estate. There's just one catch -- she must now hide from midnight until dawn while her new in-laws hunt her down with guns, crossbows and other weapons. As Grace desperately tries to survive the night, she soon finds a way to turn the tables on her not-so-lovable relatives.",$28.7M,R (Language Throughout|Bloody Images|Some Drug Use|Violence),"Matt Bettinelli-Olpin, Tyler Gillett","Guy Busick, Ryan Murphy"
https://www.rottentomatoes.com/m/twisters,Twisters,75%,"Adventure, Action, Mystery & Thriller","Lee Isaac Chung, Glen Powell, Daisy Edgar-Jones, Maura Tierney, Harry Hadden-Paton, Sasha Lane","Aug 13, 2024",2h 2m,English,"Amblin Entertainment,Universal Pictures,Warner Bros. Pictures,The Kennedy/Marshall Company","Daisy Edgar-Jones stars as Kate Cooper, a former storm chaser haunted by a devastating encounter with a tornado during her college years who now studies storm patterns on screens safely in New York City. She is lured back to the open plains by her friend, Javi (Golden Globe nominee Anthony Ramos, In the Heights) to test a groundbreaking new tracking system. There, she crosses paths with Tyler Owens (Glen Powell), the charming and reckless social-media superstar who thrives on posting his storm-chasing adventures with his raucous crew, the more dangerous the better. As storm season intensifies, terrifying phenomena never seen before are unleashed, and Kate, Tyler and their competing teams find themselves squarely in the paths of multiple storm systems converging over central Oklahoma in the fight of their lives.",$267.7M,PG-13 (Intense Action and Peril|Injury Images|Some Language),Lee Isaac Chung,Mark L. Smith
https://www.rottentomatoes.com/m/the_merry_gentlemen,The Merry Gentlemen,42%,"Comedy, Holiday, Romance","Peter Sullivan, Britt Robertson, Chad Michael Murray, Marla Sokoloff, Marc Anthony Samuel, Colt Prattes","Nov 20, 2024",1h 26m,English,"Hybrid,Gentlemen Media Group","To save her parents' small-town performing venue, a former big-city dancer decides to stage an all-male, Christmas-themed revue.",,,Peter Sullivan,"Jeffrey Schenck, Peter Sullivan, Marla Sokoloff"
https://www.rottentomatoes.com/m/transformers_one,Transformers One,89%,"Adventure, Fantasy, Animation, Action, Sci-Fi","Josh Cooley, Chris Hemsworth, Brian Tyree Henry, Scarlett Johansson, Keegan-Michael Key, Steve Buscemi","Oct 22, 2024",1h 44m,English,"Entertainment One,Hasbro Entertainment,Paramount Animation,Nickelodeon Movies","TRANSFORMERS ONE is the untold origin story of Optimus Prime and Megatron, better known as sworn enemies, but once were friends bonded like brothers who changed the fate of Cybertron forever.",$58.6M,PG (Language|Animated Action Throughout|Sci-Fi Violence),Josh Cooley,"Eric Pearson, Andrew Barrer, Gabriel Ferrari"
https://www.rottentomatoes.com/m/terrifier_3,Terrifier 3,77%,"Horror, Holiday, Mystery & Thriller","Damien Leone, David Howard Thornton, Lauren LaVera, Samantha Scaffidi, Chris Jericho, Elliot Fullam","Nov 26, 2024",2h 8m,English,"Bloody Disgusting,Dark Age Cinema","After surviving Art the Clown's Halloween massacre, Sienna and her brother are struggling to rebuild their shattered lives. As the holiday season approaches, they try to embrace the Christmas spirit and leave the horrors of the past behind. But just when they think they're safe, Art the Clown returns, determined to turn their holiday cheer into a new nightmare. The festive season quickly unravels as Art unleashes his twisted brand of terror, proving that no holiday is safe.",$50.5M,,Damien Leone,Damien Leone
https://www.rottentomatoes.com/m/blink_twice,Blink Twice,75%,Mystery & Thriller,"Zoë Kravitz, Naomi Ackie, Channing Tatum, Christian Slater, Simon Rex, Adria Arjona","Sep 17, 2024",1h 42m,English,"Free Association,this is important,Bold Choices","When tech billionaire Slater King (Channing Tatum) meets cocktail waitress Frida (Naomi Ackie) at his fundraising gala, sparks fly. He invites her to join him and his friends on a dream vacation on his private island. It's paradise. Wild nights blend into sun soaked days and everyone's having a great time. No one wants this trip to end, but as strange things start to happen, Frida begins to question her reality. There is something wrong with this place. She'll have to uncover the truth if she wants to make it out of this party alive.",$22.8M,R (Language Throughout|Drug Use|Sexual Assault|Some Sexual References|Strong Violent Content),Zoë Kravitz,"Zoë Kravitz, E.T. Feigenbaum"
https://www.rottentomatoes.com/m/bread_and_roses_2023,Bread & Roses,100%,Documentary,"Sahra Mani, Jennifer Lawrence, Justine Ciarrocchi, Sahra Mani, Malala Yousafzai, Farhad Khosravi","Nov 22, 2024",1h 28m,English,Excellent Cadaver,"""Bread & Roses"" offers a powerful window into the seismic impact on women's rights and livelihoods after Kabul fell to the Taliban in 2021. The film follows three women, in real time, as they fight to recover their autonomy. Mani captures the spirit and resilience of Afghan women through a raw depiction of their harrowing plight.",,,Sahra Mani,
https://www.rottentomatoes.com/m/trap_2024,Trap,57%,Mystery & Thriller,"M. Night Shyamalan, Josh Hartnett, Ariel Donoghue, Saleka Shyamalan, Hayley Mills, Alison Pill","Aug 30, 2024",1h 45m,English,Blinding Edge Pictures,"A father and teen daughter attend a pop concert, where they realize they're at the center of a dark and sinister event.",$42.7M,PG-13 (Some Violent Content|Brief Strong Language),M. Night Shyamalan,M. Night Shyamalan
https://www.rottentomatoes.com/m/megalopolis,Megalopolis,45%,"Drama, Fantasy, Sci-Fi","Francis Ford Coppola, Adam Driver, Giancarlo Esposito, Nathalie Emmanuel, Aubrey Plaza, Shia LaBeouf","Nov 12, 2024",2h 18m,English,American Zoetrope,"MEGALOPOLIS is a Roman Epic set in an imagined Modern America. The City of New Rome must change, causing conflict between Cesar Catilina (Adam Driver), a genius artist who seeks to leap into a utopian, idealistic future, and his opposition, Mayor Franklyn Cicero (Giancarlo Esposito), who remains committed to a regressive status quo, perpetuating greed, special interests, and partisan warfare. Torn between them is socialite Julia Cicero (Nathalie Emmanuel), the mayor's daughter, whose love for Cesar has divided her loyalties, forcing her to discover what she truly believes humanity deserves.",$7.4M,R (Language|Drug Use|Nudity|Sexual Content|Some Violence),Francis Ford Coppola,Francis Ford Coppola
https://www.rottentomatoes.com/m/elevation,Elevation,55%,"Sci-Fi, Drama, Action, Mystery & Thriller","George Nolfi, Anthony Mackie, Morena Baccarin, Maddie Hasson, Danny Boyd Jr., Shauna Earp","Nov 26, 2024",1h 30m,English,Lyrical Media,"Set in the post-apocalyptic Rocky Mountains, a single father and two women venture from the safety of their homes to face monstrous creatures to save the life of a young boy.",,R (Language),George Nolfi,"John Glenn, Jacob Roman, Kenny Ryan"
https://www.rottentomatoes.com/m/hit_man_2023,Hit Man,95%,"Comedy, Romance, Action, Mystery & Thriller, Crime","Richard Linklater, Glen Powell, Adria Arjona, Austin Amelio, Retta, Sanjay Rao","Jun 7, 2024",1h 53m,English,"Detour Pictures,Barnstorm Productions,Monarch Media,ShivHans Pictures,Aggregate Films,Netflix,AGC Studios,Cinetic Media,Detour Filmproduction","Oscar-nominated director Richard Linklater's sunlit neo-noir stars Glen Powell as strait-laced professor Gary Johnson, who moonlights as a fake hit man for the New Orleans Police Department. Preternaturally gifted at inhabiting different guises and personalities to catch hapless people hoping to bump off their enemies, Gary descends into morally dubious territory when he finds himself attracted to one of those potential criminals, a beautiful young woman named Madison (Adria Arjona). As Madison falls for one of Gary's hit man personas -- the mysteriously sexy Ron -- their steamy affair sets off a chain reaction of play acting, deception, and escalating stakes.",,R (Sexual Content|Language Throughout|Some Violence),Richard Linklater,"Richard Linklater, Glen Powell, Skip Hollandsworth"
https://www.rottentomatoes.com/m/our_little_secret,Our Little Secret,47%,"Comedy, Romance, Holiday","Stephen Herek, Lindsay Lohan, Ian Harding, Kristin Chenoweth, Jonathan Rudnitsky, Katie Baker","Nov 27, 2024",1h 40m,English,"Capital Arts Entertainment,Good Entertainment Inc.,Netflix",Two resentful exes are forced to spend Christmas under the same roof after discovering that their current partners are siblings.,,,Stephen Herek,Hailey DeDominicis
https://www.rottentomatoes.com/m/speak_no_evil_2024,Speak No Evil,83%,"Horror, Drama, Mystery & Thriller","James Watkins, James McAvoy, Mackenzie Davis, Aisling Franciosi, Alix West Lefler, Dan Hough","Oct 1, 2024",1h 50m,English,"Blumhouse Productions,Universal Pictures","When an American family is invited to spend the weekend at the idyllic country estate of a charming British family they befriended on vacation, what begins as a dream holiday soon warps into a snarled psychological nightmare.",$36.9M,R,James Watkins,James Watkins
https://www.rottentomatoes.com/m/abigail_2024,Abigail,83%,"Horror, Mystery & Thriller","Matt Bettinelli-Olpin, Tyler Gillett, Melissa Barrera, Dan Stevens, Kathryn Newton, William Catlett","May 7, 2024",1h 49m,English,"Project X Entertainment,Radio Silence","After a group of would-be criminals kidnap the 12-year-old ballerina daughter of a powerful underworld figure, all they have to do to collect a $50 million ransom is watch the girl overnight. In an isolated mansion, the captors start to dwindle, one by one, and they discover, to their mounting horror, that they're locked inside with no normal little girl.",$25.9M,R (Gore|Brief Drug Use|Pervasive Language|Strong Bloody Violence),"Matt Bettinelli-Olpin, Tyler Gillett","Stephen Shields, Guy Busick"
https://www.rottentomatoes.com/m/wolfs,Wolfs,66%,"Comedy, Action","Jon Watts, George Clooney, Brad Pitt, Amy Ryan, Austin Abrams, Poorna Jagannathan","Sep 27, 2024",1h 48m,English,"Freshman Year,Plan B Entertainment,Apple Original Films,Smokehouse Pictures","Global superstars George Clooney and Brad Pitt team up for the action comedy Wolfs. Clooney plays a professional fixer hired to cover up a high profile crime. But when a second fixer (Pitt) shows up and the two ""lone wolves"" are forced to work together, they find their night spiraling out of control in ways that neither one of them expected.",,R (Some Violent Content|Language Throughout),Jon Watts,Jon Watts
https://www.rottentomatoes.com/m/absolution_2024,Absolution,52%,"Crime, Drama, Action, Mystery & Thriller","Hans Petter Moland, Liam Neeson, Ron Perlman, Yolonda Ross, Frankie Shaw, Daniel Diemer","Nov 19, 2024",1h 52m,English,"Sculptor Media,Electromagnetic Productions","An aging gangster attempts to reconnect with his children and rectify the mistakes in his past, but the criminal underworld won't loosen their grip willingly.",,R (Some Sexual Content/Nudity|Language Throughout|Drug Use|Violence),Hans Petter Moland,Tony Gayton
